[
  {
    "phase_id": "new",
    "name": "New Moon",
    "themes": "Quiet reset, clarifying motives, committing to internal alignment.",
    "guidance": "Slow down and reset. Listen to your body and choose one clear intention instead of many goals.",
    "human_text": "Slow down and reset. Listen to your body and choose one clear intention instead of many goals."
  },
  {
    "phase_id": "waxing_crescent",
    "name": "Waxing Crescent",
    "themes": "Take first micro-actions, share drafts, invite accountability.",
    "guidance": "Take small first steps, but don’t rush to show everything yet. Let ideas grow before sharing widely.",
    "human_text": "Take small first steps, but don’t rush to show everything yet. Let ideas grow before sharing widely."
  },
  {
    "phase_id": "first_quarter",
    "name": "First Quarter",
    "themes": "Hit resistance that demands refinement or firmer commitment.",
    "guidance": "Notice what feels difficult or blocked. Decide whether to adjust your approach or commit more fully.",
    "human_text": "Notice what feels difficult or blocked. Decide whether to adjust your approach or commit more fully."
  },
  {
    "phase_id": "waxing_gibbous",
    "name": "Waxing Gibbous",
    "themes": "Fine-tuning strategy, securing resources, aligning collaborators.",
    "guidance": "Check details, expectations, and resources. Make sure everything is ready before presenting results.",
    "human_text": "Check details, expectations, and resources. Make sure everything is ready before presenting results."
  },
  {
    "phase_id": "full",
    "name": "Full Moon",
    "themes": "Insight arrives; truths are revealed; emotional tides peak.",
    "guidance": "Share what you’ve reached, acknowledge emotions, and release what no longer fits your path.",
    "human_text": "Share what you’ve reached, acknowledge emotions, and release what no longer fits your path."
  },
  {
    "phase_id": "waning_gibbous",
    "name": "Waning Gibbous",
    "themes": "Harvest, integration, and teaching from what surfaced.",
    "guidance": "Reflect on what worked. Write down lessons and thank people who supported you.",
    "human_text": "Reflect on what worked. Write down lessons and thank people who supported you."
  },
  {
    "phase_id": "last_quarter",
    "name": "Last Quarter",
    "themes": "Release, restructure, simplify commitments.",
    "guidance": "Let go of unnecessary tasks and commitments. Simplify plans and remove what drains energy.",
    "human_text": "Let go of unnecessary tasks and commitments. Simplify plans and remove what drains energy."
  },
  {
    "phase_id": "waning_crescent",
    "name": "Waning Crescent",
    "themes": "Restoration, dreams, and gestating the next cycle.",
    "guidance": "Rest more, reduce input, and avoid major decisions. Pay attention to subtle physical and emotional signals.",
    "human_text": "Rest more, reduce input, and avoid major decisions. Pay attention to subtle physical and emotional signals."
  }
]